{
  "_meta": {
    "file": "combat.json",
    "version": 1,
    "owner": "systems-designer",
    "task": "P1-F03-T06; hit chance refit P1-F03-T08; _nullMeans P1-X04; F06 notes P2-F05-T01; zoneLevelFrom D-112 P2-X09",
    "doc": "design/systems/balance-model.md section 3"
  },
  "monsterAttack": {
    "_source": "GDD > HP การตาย และการฟื้นฟู > damage มาจากไหน (monsterATK = 3 x Z^1.3, Z = zone level)",
    "monsterAtkCoef": 3,
    "monsterAtkExponent": 1.3,
    "zoneLevelFrom": "playerLevelClampedToRange",
    "_zoneLevelFrom_source": "D-112 (game-director J-8, design/reviews/F04-flow-approval.md R2-5): replaces A-P1-F03-T06-1 (was levelRangeMidpointRounded, Z = round((min + max) / 2) for everyone). GDD > การกำหนด dungeon (ช่วงเลเวลที่เหมาะสม) and ระดับเลเวลที่เหมาะสม (only players outside the range are penalised, by the distance from the range)",
    "_zoneLevelFrom_note": "Z = clamp(player level at the instant, levelRange.min, levelRange.max), used for both damage (F06 R08) and exp per tick (F05 R11). Outside the range the player plays at the nearest edge and the gap multiplier counts once from that edge: damage x levelGapDamage.damageMultPerLevelBelowRange ^ (min - level) below only, exp x max(floor, levelGapMultPerLevel ^ gap) on both sides. game-director approved damage changes beyond +-20% of the old value for players at the low end of wide ranges (e.g. level 1 in 1-35, Phase 2 base stats, solo non-Tanker: 192.8 -> 4.5 per hit; the top of a wide range gets matched-level damage, e.g. level 35 in 1-35 balanced build 63.3 -> 150.3). Formula and evidence: design/systems/balance-model.md 3.1, 17.1, 18. Vectors: damage.json fn zoneLevel (input playerLevel, rangeMin, rangeMax)"
  },
  "defense": {
    "_source": "GDD > HP การตาย และการฟื้นฟู > damage มาจากไหน; Raid Boss > ตัวเลขตั้งต้น (K = 300, DEF 300 ลด damage 50%)",
    "defSoftcap": 300
  },
  "attackCheck": {
    "_source": "GDD > HP การตาย และการฟื้นฟู > damage มาจากไหน (ทุก 45-75 วินาที ระบบสุ่มว่ามอนสเตอร์เข้ามาตีหรือเปล่า)",
    "intervalMin_s": 45,
    "intervalMax_s": 75,
    "intervalDistribution": "uniform",
    "hitChancePerCheck_pct": 54,
    "_assumption": "A-P1-F03-T06-4 (refit P1-F03-T07, D-029 ACCEPTED): GDD gives no hit chance. 54% is the least-squares fit (53.95%) of the level-25 balanced build (tier-3 gear +0, Z = L) to both GDD survival rows: 45 min to auto-retreat at damage x1.0 (D-020) and 55 min with one Tanker L25. Fit alone per row: 53.3% / 54.5%. Result at 54%: 44.4 / 55.6 min. Changed from 50 (+8%, inside the systems-designer +-20% authority). Owner: systems-designer",
    "_note": "Spec F06 R06-R07, R10 (D-094, D-096) and ADR 0003 6.4: attempts happen only in Active unlocked time. The interval clock counts only that time, pauses in Grace, Suspended and speed lock, and resumes where it stopped (never reset by leaving and coming back). Attempt i (0, 1, 2, ... per run) uses RNG stream 'hit' index i: draw 1 = interval uniform(intervalMin_s, intervalMax_s) since the previous attempt (the first one since confirm), draw 2 = hit when u < hitChancePerCheck_pct / 100. A reward tick due at the same active instant is processed first (F05 R19). Vectors: design/systems/test-vectors/run-loop.json (hitAttempt, runLoop)"
  },
  "levelGapDamage": {
    "_source": "GDD > HP การตาย และการฟื้นฟู > damage มาจากไหน (เลเวลต่ำกว่าช่วงของโซน damage x1.25 ต่อระดับที่ห่าง)",
    "damageMultPerLevelBelowRange": 1.25,
    "mode": "compound",
    "maxMult": null,
    "_nullMeans": { "maxMult": "unbounded" },
    "_assumption": "A-P1-F03-T06-2: 'x1.25 per level' read as 1.25^gap (not 1 + 0.25 x gap), no cap because the GDD says nobody adjusts it for you. Gap counts from the range minimum. Owner: game-director",
    "_note": "Spec F06 R09: a level above the range does not reduce damage (the GDD names the lower side only). The level used is the level at the instant of the attempt (F05 R16)"
  },
  "raidFailPenalty": {
    "_source": "GDD > Raid Boss > เมื่อล้มบอสไม่สำเร็จ (dungeon ทั้งเกมแข็งแกร่งขึ้น 2 เท่าตลอดสัปดาห์ถัดไป)",
    "monsterAtkMultAfterFailedRaid": 2,
    "_assumption": "A-P1-F03-T06-16: 'stronger x2' applied to monsterATK only (not HP or hit chance). Owner: game-director"
  },
  "deathProtection": {
    "_source": "GDD > HP การตาย และการฟื้นฟู > ระบบกันตาย (values live in dungeons.json > hpSafety)",
    "seeFile": "dungeons.json#hpSafety"
  }
}
